Title,Description,Start,End,Timezone,format,URL,Contact,Organiser,Eligibility,Host Institutions,Online,City,Country
Distributional Regression modeling,"""""""<h3><strong>SIH Masterclass Series</strong></h3><p>Elevate your research and come to the SIH Masterclass on distributional regression! </p><p>The classical linear model and its generalized extension (GLM) are widely used in applied statistics. However, required model assumptions are frequently not met, resulting in estimates of effects that can be biased. </p><p>This Masterclass will outline how distributional regression, an increasingly popular tool in regression analysis, overcomes these limitations. It does this by providing the ability to link distributional parameters beyond the mean to additive predictors, for a practically unlimited choice of response distributions.</p><p><strong>Attendance options:</strong></p><p>You will get the most out of this session by attending in person. This way allows you to interact with the presenters, ask questions directly, and catch up after the session. Please only choose online if circumstances prevent you from attending campus.</p><p><strong>In person: </strong> Choose the <em><strong>In person</strong></em> ticket option.</p><p><strong>Online:</strong> Choose the <em><strong>Online Zoom</strong></em> ticket option. It is recommended to have a dual monitor setup to view and participate remotely in the session. Registered attendees will receive a link to the Zoom event closer to the date. </p><p>Sydney Informatics Hub </p><ul><li>Open to: Academic and Professional Staff, research students, and affiliates of The University of Sydney (with a valid UniKey)</li><li>Please use your University of Sydney email address to register i.e. @sydney.edu.au, @uni.sydney.edu.au, etc</li></ul><p><strong>Registrations from open web email clients (@gmail.com, @hotmail.com etc) will AUTOMATICALLY be cancelled, without us contacting you.</strong></p>""""""",2023-05-25T15:00:00,2023-05-25T16:00:00,Australia/Sydney,online,https://www.sydney.edu.au/research/facilities/sydney-informatics-hub/workshops-and-training/training-calendar.html,sih.training@sydney.edu.au,Sydney Informatics Hub,host_institution,University of Sydney,TRUE,Sydney,Australia
Intro to REDCap,"""""""<p>Research Electronic Data Capture (REDCap) is a secure web-based database application maintained by the University of Sydney. It is ideal for collecting and managing participant data and administering online surveys, with features supporting longitudinal data collection, complex team workflows and exports to a range of statistical analysis programs.</p><p><strong>In ""Intro to REDCap"", we will cover:</strong></p><ul><li>How to build a simple data entry project</li><li>How to collect data</li><li>How to add users/collaborators</li><li>How to export data</li></ul><p>Please note we will <strong>not cover surveys</strong>, as these are covered separately in our ""Surveys in REDCap"" training session.</p><p><strong>Target audience: </strong>Students and staff at the University of Sydney who need to collect electronic data or responses from participants into a structured database.</p><p><strong>Open to: </strong></p><ul><li>This workshop is provided at no cost to researchers studying at, employed by or affiliated with the University of Sydney. </li><li>This includes Honours and higher degree by research students, academic staff, and professional staff who do research.
 </li><li>Please use your University of Sydney email address to register i.e. @sydney.edu.au, @uni.sydney.edu.au, etc
 If you do not have a UniKey, please contact us to confirm your position after registration.
</li><li>Registrations from open web email clients (@gmail.com, @hotmail.com etc) will AUTOMATICALLY be cancelled, without us contacting you!!!</li></ul><p><strong>Accessing the webinar: </strong>Your confirmation<strong> email from Eventbrite</strong> will contain a button which will provide the details to access the Zoom webinar</p><p><strong>For more information: </strong>digital.research@sydney.edu.au</p><p>Sydney Informatics Hub offers a broad range of training to researchers at the University. Please see our <a href=""https://sydney.edu.au/research/facilities/sydney-informatics-hub/workshops-and-training.html"" target=""_blank"" rel=""nofollow noopener noreferrer"">training site </a>for more information.</p>""""""",2023-06-08T10:00:00,2023-06-08T12:00:00,Australia/Sydney,Unknown,https://www.sydney.edu.au/research/facilities/sydney-informatics-hub/workshops-and-training/training-calendar.html,sih.training@sydney.edu.au,Sydney Informatics Hub,host_institution,University of Sydney,TRUE,Sydney,Australia
Surveys in REDCap,"""""""<p>Research Electronic Data Capture (REDCap) is a secure web-based database application maintained by the University of Sydney. It is ideal for collecting and managing participant data and administering online surveys, with features supporting longitudinal data collection, complex team workflows and exports to a range of statistical analysis programs.</p><p><strong>In ""Surveys in REDCap"", we will cover:</strong></p><ul><li>How to turn a data collection instrument into a survey</li><li>How to distribute surveys</li><li>How to work with multiple surveys within a project (e.g. Survey Queue, Automated Survey Invitation features)</li></ul><p><strong>Essential pre-requisites: </strong>You must know how to build a basic data entry project in REDCap. Please attend our ""Intro to REDCap"" webinar to cover this.</p><p><strong>Target audience:</strong> Students and staff at the University of Sydney who need to collect electronic data or responses from participants into a structured database.</p><p><strong>Open to:</strong> </p><ul><li>This workshop is provided at no cost to researchers studying at, employed by or affiliated with the University of Sydney. </li><li>This includes Honours and higher degree by research students, academic staff, and professional staff who do research.
 </li><li>Please use your University of Sydney email address to register i.e. @sydney.edu.au, @uni.sydney.edu.au, etc
 If you do not have a UniKey, please contact us to confirm your position after registration.
</li><li>Registrations from open web email clients (@gmail.com, @hotmail.com etc) will AUTOMATICALLY be cancelled, without us contacting you!!!</li></ul><p><strong>Accessing the webinar:</strong> Your confirmation<strong> email from Eventbrite</strong> will contain a button which will provide the details to access the Zoom webinar</p><p><strong>For more information: </strong>digital.research@sydney.edu.au</p><p>Sydney Informatics Hub offers a broad range of training to researchers at the University. Please see our <a href=""https://sydney.edu.au/research/facilities/sydney-informatics-hub/workshops-and-training.html"" target=""_blank"" rel=""nofollow noopener noreferrer"">training site </a>for more information.</p>""""""",2023-06-15T10:00:00,2023-06-15T12:00:00,Australia/Sydney,Unknown,https://www.sydney.edu.au/research/facilities/sydney-informatics-hub/workshops-and-training/training-calendar.html,sih.training@sydney.edu.au,Sydney Informatics Hub,host_institution,University of Sydney,TRUE,Sydney,Australia
Introduction to Machine Learning with Python,"""""""<p>For course details, syllabus, prerequisites and setup instructions, an email will be sent to attendees closer to the date.</p><p><strong>Sydney Informatics Hub</strong></p><ul><li>Open to: Academic and Professional Staff, research students, and affiliates of The University of Sydney (with a valid UniKey)</li><li>Please use your University of Sydney email address to register i.e. @sydney.edu.au, @uni.sydney.edu.au, etc</li></ul><p><strong>Registrations from open web email clients (@gmail.com, @hotmail.com etc) will AUTOMATICALLY be cancelled, without us contacting you.</strong></p><p><strong>If you need to cancel your registration, please do so ON EVENTBRITE to enable people on the waitinglist to be automatically added to the workshop attendees.</strong></p>""""""",2023-05-02T09:00:00,2023-05-03T16:30:00,Australia/Sydney,online,https://www.sydney.edu.au/research/facilities/sydney-informatics-hub/workshops-and-training/training-calendar.html,sih.training@sydney.edu.au,Sydney Informatics Hub,host_institution,University of Sydney,TRUE,Sydney,Australia
A Taste of Juxtorpus: The Latest ATAP Tool for Contrasting Text Collections,"""""""<p>Join us for a hybrid taster webinar on the latest addition to the suite of ATAP text analysis tools - Juxtorpus. Developed to provide a unified framework for managing and exploring text contents and metadata, Juxtorpus offers a Corpus package that enables flexible building, exploration, and slicing of your corpus while maintaining its shape. The Jux tool allows for easy comparison and highlighting of differences between any two corpora.</p><p>During the webinar, we'll introduce you to the essential tools and visualisations that come off-the-shelf with the Corpus package, making it easy to explore your text quickly. We'll also show you how to use other ATAP tools in combination with the Corpus to create a reusable workflow that will boost your analysis capabilities.</p><p>This webinar comes with minimal hands-on opportunities, and No programming knowledge or skills are required, as the tool will be presented as an online Jupyter Notebook. We invite anyone interested in learning how to handle and analyse their digital text collections to join us. </p><p>If you're curious about how Juxtorpus can help you with your research, register for this taster session and join us, either in-person or online. If you find it to be the right ATAP tool for your needs, we invite you to register for the full-day training workshop in the second semester.</p><p>When: 10:30am – 12pm, Thursday, 25th May 2023</p><p>How: Hybrid (In-person: USyd Participants Only +  Online: External Particpants)</p><p>Where: On campus venue and Zoom link will be sent to the participants a few days before the event.</p><p><strong>Important Notice:</strong></p><ul><li>T﻿he online webinar is open to public</li><li>The in-person participants are restricted to: Academic and Professional Staff, research students, and affiliates of The University of Sydney (with a valid UniKey)</li><li>Please use your University of Sydney email address to register i.e. @sydney.edu.au, @uni.sydney.edu.au, etc for the in-person registrations.</li></ul><p><strong>Registrations from open web email clients (@gmail.com, @hotmail.com etc) will AUTOMATICALLY be cancelled, without us contacting you.</strong></p><p><strong>If you need to cancel your registration, please do so ON EVENTBRITE to enable people on the waitinglist to be automatically added to the workshop attendees.</strong></p>""""""",2023-05-25T10:30:00,2023-05-25T12:00:00,Australia/Sydney,hybrid,https://www.sydney.edu.au/research/facilities/sydney-informatics-hub/workshops-and-training/training-calendar.html,sih.training@sydney.edu.au,Sydney Informatics Hub,host_institution,University of Sydney,TRUE,Sydney,Australia
Research Essentials,"""""""<p><strong>Research Essentials - Analysing your data</strong></p><p>This workshop presents methods and concepts that will help you create world-changing research worthy of top-tier journals.</p><p>We introduce the concept of a research workflow, a series of defined steps that will assist you in thinking about your data and preparing it for statistical analysis. We introduce you to the resources available from both Sydney Informatics Hub and across the University that will support you in proceeding from hypothesis generation all the way through to publication.</p><p>Data analysis concepts will be covered in detail, including: how experimental design fits into hypothesis generation and your final publication; how to manage your analysis data and Exploratory Data Analysis (EDA) – an essential and often-overlooked stage of data analysis for determining the appropriate statistical methods to apply in your research.</p><p>We will show you some of the more advanced statistical analysis methods to give you and idea of what is possible.</p><p>Note that this workshop does not require knowledge of or use of specific statistics software.  The analysis methods may be performed using a range of commonly available software through the university.</p><p><strong>Attendance options:</strong></p><p><strong>In person:</strong>  Choose the <strong><em>In person</em></strong> ticket option. University rules governing COVID related requirements will apply in the venue. In the event that in person delivery is not possible, you will be provided with the Zoom link for remote attendance.</p><p><strong>Online:</strong> Choose the <strong><em>Online Zoom</em></strong> ticket option. It is recommended to have a dual monitor setup to view and participate remotely in the session. Registered attendees will receive a link to the Zoom event closer to the date.</p><p><strong>Sydney Informatics Hub</strong></p><ul><li>Open to: Academic and Professional Staff, research students, and affiliates of The University of Sydney (with a valid UniKey)</li><li>Please use your University of Sydney email address to register i.e. @sydney.edu.au, @uni.sydney.edu.au, etc</li><li>If you do not have a UniKey, please contact us to confirm your position after registration.</li></ul><p><strong>Registrations from open web email clients (@gmail.com, @hotmail.com etc) will AUTOMATICALLY be cancelled, without us contacting you!</strong></p>""""""",2023-07-05T09:30:00,2023-07-05T11:00:00,Australia/Sydney,hybrid,https://www.sydney.edu.au/research/facilities/sydney-informatics-hub/workshops-and-training/training-calendar.html,sih.training@sydney.edu.au,Sydney Informatics Hub,host_institution,University of Sydney,TRUE,Sydney,Australia
Meta-Analysis: an introduction,"""""""<p><strong>Meta Analysis - An Introduction, run by the Sydney Informatics Hub. </strong></p><p>This workshop provides research students with a theoretical and practical introduction to meta-analysis as part of a systematic review. In this workshop we will be examining the process of performing a meta-analysis in particular focusing on key statistical concepts such as heterogeneity and Fixed and Random effects modelling. </p><p>The available choices of statistical software will be discussed and participants will be shown worked examples using the <strong>metafor</strong> package in R. A basic knowledge of R software is desirable, but not necessary since participants are not expected to produce and run their own code during the workshop. </p><p><strong>Attendance options:</strong></p><p><strong>In person:</strong> Choose the <strong><em>In person</em></strong> ticket option. University rules governing COVID related requirements will apply in the venue. In the event that in person delivery is not possible, you will be provided with the Zoom link for remote attendance.</p><p><strong>Online</strong>: Choose the <strong><em>Online Zoom</em></strong> ticket option. It is recommended to have a dual monitor setup to view and participate remotely in the session. Registered attendees will receive a link to the Zoom event closer to the date.</p><p>Sydney Informatics Hub </p><ul><li>This workshop is provided at no cost to researchers studying at, employed by or affiliated with the University of Sydney. This includes Honours and higher degree by research students, academic staff, and professional staff who do research.</li><li>Please use your University of Sydney email address to register i.e. @sydney.edu.au, @uni.sydney.edu.au, etc</li><li>If you do not have a UniKey, please contact us to confirm your position after registration.</li></ul><p>Registrations from open web email clients (@gmail.com, @hotmail.com etc) will AUTOMATICALLY be cancelled, without us contacting you!!!</p>""""""",2023-07-05T11:30:00,2023-07-05T13:00:00,Australia/Sydney,hybrid,https://www.sydney.edu.au/research/facilities/sydney-informatics-hub/workshops-and-training/training-calendar.html,sih.training@sydney.edu.au,Sydney Informatics Hub,host_institution,University of Sydney,TRUE,Sydney,Australia
Introduction to Survival Analysis,"""""""<p>Survival analysis is used when you want to measure the time elapsed up to when a specified event occurs. It is commonly used in studies where subjects are followed until death occurs, hence the name.</p><p>In this workshop we will introduce some key concepts pertaining to survival analysis including censoring of cases, the survival function, and the hazard ratio estimator. The Kaplan Meier survival curve will be explained through a worked example and the technique of Cox proportional hazards regression will be introduced using the same example dataset.</p><p>Participants will be provided with software code in SPSS and R to reproduce the analysis presented in the workshop.</p><p><strong>Attendance options:</strong></p><p><strong>In person: </strong>Choose the <em><strong>In person</strong></em> ticket option. University rules governing COVID related requirements will apply in the venue. In the event that in person delivery is not possible, you will be provided with the Zoom link for remote attendance.</p><p><strong>Online:</strong> Choose the <em><strong>Online Zoom</strong></em> ticket option. It is recommended to have a dual monitor setup to view and participate remotely in the session. Registered attendees will receive a link to the Zoom event closer to the date.</p><p>Sydney Informatics Hub</p><ul><li>Open to: Academic and Professional Staff, research students, and affiliates of The University of Sydney (with a valid UniKey)</li><li>Please use your University of Sydney email address to register i.e. @sydney.edu.au, @uni.sydney.edu.au, etc</li><li>If you do not have a UniKey, please contact us to confirm your position after registration.</li></ul><p><strong>Registrations from open web email clients (@gmail.com, @hotmail.com etc) will AUTOMATICALLY be cancelled, without us contacting you!</strong></p>""""""",2023-07-05T14:00:00,2023-07-05T15:30:00,Australia/Sydney,hybrid,https://www.sydney.edu.au/research/facilities/sydney-informatics-hub/workshops-and-training/training-calendar.html,sih.training@sydney.edu.au,Sydney Informatics Hub,host_institution,University of Sydney,TRUE,Sydney,Australia
Experimental Design,"""""""<p>This presentation and workshop focuses on the key aspects of experimental design that researchers and students may need to apply in their research. Higher degree research students engaging in new research are especially invited to attend. During the workshop there will be the opportunity to discuss your own research question and associated experimental design.</p><p>The workshop will include the following topics:</p><ul><li>your research question</li><li>experimental validity</li><li>randomisation and bias</li><li>blinding and bias</li><li>blocking and confounding</li><li>fixed and random effects</li><li>replication, experimental units</li></ul><p>No pre-requisite knowledge of statistical methods is required.</p><p><strong>Attendance options:</strong></p><p>You will get the most out of this session by attending in person. This way allows you to interact with the presenters, ask questions directly, and catch up after the session. Please only choose online if circumstances prevent you from attending campus.</p><p><strong>In person: </strong> Choose the <em><strong>In person</strong></em> ticket option.</p><p><strong>Online:</strong> Choose the <em><strong>Online Zoom</strong></em> ticket option. It is recommended to have a dual monitor setup to view and participate remotely in the session. Registered attendees will receive a link to the Zoom event closer to the date. </p><p>Sydney Informatics Hub </p><ul><li>Open to: Academic and Professional Staff, research students, and affiliates of The University of Sydney (with a valid UniKey)</li><li>Please use your University of Sydney email address to register i.e. @sydney.edu.au, @uni.sydney.edu.au, etc</li><li>If you do not have a UniKey, please contact us to confirm your position after registration.</li></ul><p><strong>Registrations from open web email clients (@gmail.com, @hotmail.com etc) will AUTOMATICALLY be cancelled, without us contacting you!</strong></p>""""""",2023-07-18T09:30:00,2023-07-18T11:00:00,Australia/Sydney,hybrid,https://www.sydney.edu.au/research/facilities/sydney-informatics-hub/workshops-and-training/training-calendar.html,sih.training@sydney.edu.au,Sydney Informatics Hub,host_institution,University of Sydney,TRUE,Sydney,Australia
Linear Models 3,"""""""<p><strong>Linear Models 3: Advanced topics,  tips and tricks</strong></p><p>Discusses topics such as:</p><ul><li>Reporting and Interpretation (estimated marginal means, confidence vs prediction intervals, applying and correcting for multiple comparisons, reporting variable *Importance*, plus other reporting and interpretation tricks)</li><li>Model Parametrisation using the Design Matrix (interpreting categorical predictor parameters, dummy coding, effects coding)</li><li>More on Mixed Models (introducing the random slope)</li></ul><p>This is the third of 3 workshops for researchers interested in statistical methods such as linear regression, ANOVA, ANCOVA, mixed models, logistic/binary and count (Poisson) regression. Each one builds on the preceding workshops and together they show how all these analyses can be performed using the same easy to understand Generalised Linear Mixed Model (GLMM) framework and workflow. As well as how they can be used to analyse experimental designs such as Control vs Treatment, Randomised Control Trials (RCT’s), Before After Control Impact (BACI) analysis, repeated measures plus many more. There is also a 4th complementary workshop called Statistical Model Building which we recommend for those experienced with Linear Models or who have done at least the first 2 of our workshops.</p><p>The material is organised around Statistical Workflows applicable in any software that give step by step instructions on how to do the analysis including assumption testing, model interpretation and presentation of results.</p><p><strong>Attendance options:</strong></p><ul><li><strong>In person</strong>:  Choose the <strong><em>In person</em></strong> ticket option. University rules governing COVID related requirements will apply in the venue. In the event that in person delivery is not possible, you will be provided with the Zoom link for remote attendance.</li><li><strong>Online</strong>: Choose the <em><strong>Online Zoom</strong></em> ticket option. It is recommended to have a dual monitor setup to view and participate remotely in the session. Registered attendees will receive a link to the Zoom event closer to the date.</li></ul><p>Sydney Informatics Hub </p><ul><li>This workshop is provided at no cost to researchers studying at, employed by or affiliated with the University of Sydney. This includes Honours and higher degree by research students, academic staff, and professional staff who do research.</li><li>Please use your University of Sydney email address to register i.e. @sydney.edu.au, @uni.sydney.edu.au, etc</li><li>If you do not have a UniKey, please contact us to confirm your position after registration.</li></ul><p><strong>Registrations from open web email clients (@gmail.com, @hotmail.com etc) will AUTOMATICALLY be cancelled, without us contacting you!!!</strong></p>""""""",2023-07-18T11:30:00,2023-07-18T13:00:00,Australia/Sydney,hybrid,https://www.sydney.edu.au/research/facilities/sydney-informatics-hub/workshops-and-training/training-calendar.html,sih.training@sydney.edu.au,Sydney Informatics Hub,host_institution,University of Sydney,TRUE,Sydney,Australia
